{
  "schema_version": "mssr.scenario.v1",
  "name": "two_modules_contact",
  "attachment_mode": "continuous",
  "reset_every_steps": 0,
  "modules": [
    {
      "index": 0,
      "module_id": "sphere_0",
      "position": [0.0, 0.0, 1.0],
      "radius": 0.6,
      "mass": 0.5,
      "color": [0.1, 0.35, 1.0]
    },
    {
      "index": 1,
      "module_id": "sphere_1",
      "position": [1.2, 0.0, 1.0],
      "radius": 0.6,
      "mass": 0.5,
      "color": [0.95, 0.35, 0.15]
    }
  ]
}
